arxiv_id,title,authors,src,url,pub_date,upd_date,doi,abstract
2201.00198,"Symmetric Matrices, Signed Graphs, and Nodal Domain Theorems","['Chuanyuan Ge', 'Shiping Liu']",ARXIV,http://arxiv.org/pdf/2201.00198v3,2022-01-01T14:51:55Z,2022-10-20T02:25:39Z,['10.48550/arXiv.2201.00198'],"In 2001, Davies, Gladwell, Leydold, and Stadler proved discrete nodal domain theorems for eigenfunctions of generalized Laplacians, i.e., symmetric matrices with non-positive off-diagonal entries. In this paper, we establish nodal domain theorems for arbitrary symmetric matrices by exploring the induced signed graph structure. Our concepts of nodal domains for any function on a signed graph are switching invariant. When the induced signed graph is balanced, our definitions and upper bound estimates reduce to existing results for generalized Laplacians. Our approach provides a more conceptual understanding of Fiedler's results on eigenfunctions of acyclic matrices. This new viewpoint leads to lower bound estimates for the number of strong nodal domains which improves previous results of Berkolaiko and Xu-Yau. We also prove a new type of lower bound estimates by a duality argument."
2201.00338,Convergence rates for the joint solution of inverse problems with compressed sensing data,"['Andrea Ebner', 'Markus Haltmeier']",ARXIV,http://arxiv.org/pdf/2201.00338v2,2022-01-02T11:25:25Z,2022-05-16T09:01:15Z,"['10.48550/arXiv.2201.00338', '10.1088/1361-6420/aca5ae']","Compressed sensing (CS) is a powerful tool for reducing the amount of data to be collected while maintaining high spatial resolution. Such techniques work well in practice and at the same time are supported by solid theory. Standard CS results assume measurements to be made directly on the targeted signal. In many practical applications, however, CS information can only be taken from indirect data $h_\star = W x_\star$ related to the original signal by an additional forward operator. If inverting the forward operator is ill-posed, then existing CS theory is not applicable. In this paper, we address this issue and present two joint reconstruction approaches, namely relaxed $\ell^1$ co-regularization and strict $\ell^1$ co-regularization, for CS from indirect data. As main results, we derive error estimates for recovering $x_\star$ and $h_\star$. In particular, we derive a linear convergence rate in the norm for the latter. To obtain these results, solutions are required to satisfy a source condition and the CS measurement operator is required to satisfy a restricted injectivity condition. We further show that these conditions are not only sufficient but even necessary to obtain linear convergence."
2201.00130,Structural Diversity and Superconductivity in S-P-H Ternary Hydrides Under Pressure,"['Nisha Geng', 'Tiange Bi', 'Eva Zurek']",ARXIV,http://arxiv.org/pdf/2201.00130v1,2022-01-01T06:47:58Z,2022-01-01T06:47:58Z,"['10.48550/arXiv.2201.00130', '10.1021/acs.jpcc.1c10976']","Evolutionary structure searches revealed a plethora of stable and low-enthalpy metastable phases in the S-P-H ternary phase diagram under pressure. A wide variety of crystalline structure types were uncovered ranging from those possessing one-dimensional chains, two-dimensional sheets based on S-H or S-P-H square lattices as well as S-H or P-H honeycombs, and cage-like structures. Some of the cage-like structures could be derived from doping the high-pressure high-temperature superconducting $Im\bar{3}m$ H$_3$S phase with phosphorous. Most of the discovered compounds were metallic, however those derived from $Im\bar{3}m$ H$_3$S lattices with low levels of P-doping were predicted to possess the highest superconducting critical temperatures ($T_c$s). The propensity for phosphorous to assume octahedral coordination, as well as the similar radii of sulfur and phosphorous are key to maintaining a high density of states at the Fermi level in $Im\bar{3}m$ S$_{0.875}$P$_{0.125}$H$_3$, whose $T_c$ was estimated to be similar to that of H$_3$S at 200~GPa."
2201.00482,On the Shafarevich conjecture for irreducible symplectic varieties,['Teppei Takamatsu'],ARXIV,http://arxiv.org/pdf/2201.00482v2,2022-01-03T05:29:30Z,2022-04-25T02:45:48Z,['10.48550/arXiv.2201.00482'],"Irreducible symplectic varieties are higher-dimensional analogues of K3 surfaces. In this paper, we prove the Shafarevich conjecture for irreducible symplectic varieties of fixed deformation class. We also observe that the second cohomological generalization of the Shafarevich conjecture does not hold in general, and discuss another formulation of a cohomological generalization."
2201.00373,Percolation on spatial anisotropic networks,"['Ouriel Gotesdyner', 'Bnaya Gross', 'Dana Vaknin Ben Porath', 'Shlomo Havlin']",ARXIV,http://arxiv.org/pdf/2201.00373v1,2022-01-02T16:01:13Z,2022-01-02T16:01:13Z,"['10.48550/arXiv.2201.00373', '10.1088/1751-8121/ac6914']","Many realistic systems such as infrastructures are characterized by spatial structure and anisotropic alignment. Here we propose and study a model for dealing with such characteristics by introducing a parameter that controls the strength of the anisotropy in the spatial network. This parameter is added to an existing isotropic model used to describe networks under spatial constraints, thus generalizing the spatial model to take into account both spatial and anisotropic features. We study the resilience of such networks by using a percolation process and find that anisotropy has a negative impact on a network's robustness. In addition, our results suggest that the anisotropy in this model does not affect the critical exponent of the correlation length, $\nu$, which remains the same as the known $\nu$ in 2D isotropic lattices."
2201.00178,Imaging the Sun's near-surface flows using mode-coupling analysis,"['Prasad Mani', 'Chris Hanson', 'Shravan Hanasoge']",ARXIV,http://arxiv.org/pdf/2201.00178v1,2022-01-01T12:19:02Z,2022-01-01T12:19:02Z,"['10.48550/arXiv.2201.00178', '10.3847/1538-4357/ac474e']","The technique of normal-mode coupling is a powerful tool with which to seismically image non-axisymmetric phenomena in the Sun. Here we apply mode coupling in the Cartesian approximation to probe steady, near-surface flows in the Sun. Using Doppler cubes obtained from the Helioseismic and Magnetic Imager onboard the Solar Dynamics Observatory, we perform inversions on mode-coupling measurements to show that the resulting divergence and radial vorticity maps at supergranular length scales ($\sim$30 Mm) near the surface compare extremely well with those obtained using the Local Correlation Tracking method. We find that the Pearson correlation coefficient is $\geq$ 0.9 for divergence flows, while $\geq$ 0.8 is obtained for the radial vorticity."
2201.00395,Operator spreading in quantum hardcore gases,['Marko Medenjak'],ARXIV,http://arxiv.org/pdf/2201.00395v2,2022-01-02T19:20:46Z,2022-09-06T09:21:34Z,"['10.48550/arXiv.2201.00395', '10.1088/1751-8121/ac8fc4']","In this article we study a set of integrable quantum cellular automata,the quantum hardcore gases (QHCG), with an arbitrary local Hilbert space dimension, and discuss the matrix product ansatz based approach for solving the dynamics of local operators analytically. Subsequently, we focus on the dynamics of operator spreading, in particular on the out-of-time ordered correlation functions (OTOCs), operator weight spreading and operators space entanglement entropy (OSEE). All of the quantities were conjectured to provide signifying features of integrable systems and quantum chaos. We show that in QHCG OTOCs spread diffusively and that in the limit of the large local Hilbert space dimension they increase linearly with time, despite their integrability. On the other hand, it was recently conjectured that operator weight front, which is associated with the extent of operators, spreads diffusively in both, integrable and generic systems, but its decay seems to differ in these two cases. We observe that the spreading of the operator weight front in QHCG is markedly different from chaotic, generic integrable and free systems, as the front freezes in the long time limit. Finally, we discuss the OSEE in QHCG and show that it grows at most logarithmically with time in accordance with the conjectured behaviour for interacting integrable systems."
2201.00105,Topological confinement in Skyrme holography,"['Casey Cartwright', 'Benjamin Harms', 'Matthias Kaminski', 'Ronny Thomale']",ARXIV,http://arxiv.org/pdf/2201.00105v2,2022-01-01T03:33:41Z,2022-01-05T19:59:38Z,"['10.48550/arXiv.2201.00105', '10.1088/1361-6382/ac6c73']","We study phase transitions in five-dimensional Einstein Gravity with a negative cosmological constant, coupled to a Skyrme matter field. These transitions are topological generalizations of the Hawking-Page transition between thermal Anti de Sitter (AdS) spacetime and an AdS black hole. Phases are characterized by a topological number associated with the Skyrme field configuration. Depending on that topological number and on the Skyrme coupling strength, there occur transitions between those phases at two, one, or no value(s) of the temperature. Through the holographic (AdS/CFT) correspondence, these solutions are dual to topologically non-trivial states in a conformal field theory (CFT) with an SU(2)-symmetry, which support either confined or deconfined (quasi-)particles at strong coupling. We compare to similar known phase transitions, and discuss potential applications to confinement in topological phases of condensed matter and the quark-gluon plasma."
2201.00176,Correlation inequalities for the uniform 8-vertex model and the toric code model,"['Jakob E. Björnberg', 'Benjamin Lees']",ARXIV,http://arxiv.org/pdf/2201.00176v1,2022-01-01T12:10:39Z,2022-01-01T12:10:39Z,['10.48550/arXiv.2201.00176'],"We elucidate connections between four models in statistical physics and probability theory: (1) the toric code model of Kitaev, (2) the uniform eight-vertex model, (3) random walk on a hypercube, and (4) a classical Ising model with four-body interaction. As a consequence of our analysis (and of the GKS-inequalities for the Ising model) we obtain correlation inequalities for the toric code model and the uniform eight-vertex model."
2201.00108,The Mathieu group $M_{23}$ as additive functions on the finite field of size ${2^{11}}$,"['Yiming Bing', 'Bright Hu', 'Ronni Hu', 'Rhianna Li', 'Stefan Lu', 'Finn McDonald', 'Michael Sun', 'Nicholas Wolfe', 'Joshua Yao', 'Leon Zhou', 'Nathan Zhou']",ARXIV,http://arxiv.org/pdf/2201.00108v1,2022-01-01T03:58:49Z,2022-01-01T03:58:49Z,['10.48550/arXiv.2201.00108'],"We explicitly extend the standard permutation action of the Mathieu group $M_{23}$ on a 23 element set $C=C_{23}$ contained in a finite field of $2^{11}$ elements $\mathbb{F}_{2^{11}}$ to additive functions on this finite field. That is we represent $M_{23}$ as functions $\varphi:\mathbb{F}_{2^{11}}\to \mathbb{F}_{2^{11}}$ such that $\varphi(x+y)=\varphi(x)+\varphi(y)$ and $\varphi|_{C}$ is the standard permutation action. We give explicit $11\times 11$ matrices for the pair of standard generators of order $23$ and order $5$, as well as many tables to help facilitate future calculations."
2201.00412,Bayesian Generalized Additive Model Selection Including a Fast Variational Option,"['Virginia X. He', 'Matt P. Wand']",ARXIV,http://arxiv.org/pdf/2201.00412v6,2022-01-02T20:16:19Z,2023-09-28T05:43:49Z,['10.48550/arXiv.2201.00412'],"We use Bayesian model selection paradigms, such as group least absolute shrinkage and selection operator priors, to facilitate generalized additive model selection. Our approach allows for the effects of continuous predictors to be categorized as either zero, linear or non-linear. Employment of carefully tailored auxiliary variables results in Gibbsian Markov chain Monte Carlo schemes for practical implementation of the approach. In addition, mean field variational algorithms with closed form updates are obtained. Whilst not as accurate, this fast variational option enhances scalability to very large data sets. A package in the R language aids use in practice."
2201.00245,Extremely strong DLAs at high redshift: Gas cooling and H$_2$ formation,"['K. N. Telikova', 'S. A. Balashev', 'P. Noterdaeme', 'J. -K. Krogager', 'A. Ranjan']",ARXIV,http://arxiv.org/pdf/2201.00245v1,2022-01-01T22:35:42Z,2022-01-01T22:35:42Z,"['10.48550/arXiv.2201.00245', '10.1093/mnras/stab3800']","We present a spectroscopic investigation with VLT/X-shooter of seven candidate extremely strong damped Lyman-$\alpha$ absorption systems (ESDLAs, $N(\text{HI})\ge 5\times 10^{21}$ cm$^{-2}$) observed along quasar sightlines. We confirm the extremely high column densities, albeit slightly (0.1~dex) lower than the original ESDLA definition for four systems. We measured low-ionisation metal abundances and dust extinction for all systems. For two systems we also found strong associated H$_2$ absorption $\log N(\text{H$_2$)[cm$^{-2}$]}=18.16\pm0.03$ and $19.28\pm0.06$ at $z=3.26$ and $2.25$ towards J2205+1021 and J2359+1354, respectively), while for the remaining five we measured conservative upper limits on the H$_2$ column densities of typically $\log N(\text{H$_2$)[cm$^{-2}$]}<17.3$. The increased H$_2$ detection rate ($10-55$% at 68% confidence level) at high HI column density compared to the overall damped Lyman-$\alpha$ population ($\sim 5-10$%) confirms previous works. We find that these seven ESDLAs have similar observed properties as those previously studied towards quasars and gamma-ray burst afterglows, suggesting they probe inner regions of galaxies. We use the abundance of ionised carbon in excited fine-structure level to calculate the cooling rates through the CII $\lambda$158$\mu$m emission, and compare them with the cooling rates from damped Lyman-$\alpha$ systems in the literature. We find that the cooling rates distribution of ESDLAs also presents the same bimodality as previously observed for the general (mostly lower HI column density) damped Lyman-$\alpha$ population."
2201.00418,Succinct Differentiation of Disparate Boosting Ensemble Learning Methods for Prognostication of Polycystic Ovary Syndrome Diagnosis,"['Abhishek Gupta', 'Sannidhi Shetty', 'Raunak Joshi', 'Ronald Melwin Laban']",ARXIV,http://arxiv.org/pdf/2201.00418v2,2022-01-02T21:06:41Z,2022-08-14T00:49:40Z,"['10.48550/arXiv.2201.00418', '10.1109/ICAC353642.2021.9697163']","Prognostication of medical problems using the clinical data by leveraging the Machine Learning techniques with stellar precision is one of the most important real world challenges at the present time. Considering the medical problem of Polycystic Ovary Syndrome also known as PCOS is an emerging problem in women aged from 15 to 49. Diagnosing this disorder by using various Boosting Ensemble Methods is something we have presented in this paper. A detailed and compendious differentiation between Adaptive Boost, Gradient Boosting Machine, XGBoost and CatBoost with their respective performance metrics highlighting the hidden anomalies in the data and its effects on the result is something we have presented in this paper. Metrics like Confusion Matrix, Precision, Recall, F1 Score, FPR, RoC Curve and AUC have been used in this paper."
2201.00382,ECOD: Unsupervised Outlier Detection Using Empirical Cumulative Distribution Functions,"['Zheng Li', 'Yue Zhao', 'Xiyang Hu', 'Nicola Botta', 'Cezar Ionescu', 'George H. Chen']",ARXIV,http://arxiv.org/pdf/2201.00382v3,2022-01-02T17:28:35Z,2022-08-25T01:50:19Z,"['10.48550/arXiv.2201.00382', '10.1109/TKDE.2022.3159580']","Outlier detection refers to the identification of data points that deviate from a general data distribution. Existing unsupervised approaches often suffer from high computational cost, complex hyperparameter tuning, and limited interpretability, especially when working with large, high-dimensional datasets. To address these issues, we present a simple yet effective algorithm called ECOD (Empirical-Cumulative-distribution-based Outlier Detection), which is inspired by the fact that outliers are often the ""rare events"" that appear in the tails of a distribution. In a nutshell, ECOD first estimates the underlying distribution of the input data in a nonparametric fashion by computing the empirical cumulative distribution per dimension of the data. ECOD then uses these empirical distributions to estimate tail probabilities per dimension for each data point. Finally, ECOD computes an outlier score of each data point by aggregating estimated tail probabilities across dimensions. Our contributions are as follows: (1) we propose a novel outlier detection method called ECOD, which is both parameter-free and easy to interpret; (2) we perform extensive experiments on 30 benchmark datasets, where we find that ECOD outperforms 11 state-of-the-art baselines in terms of accuracy, efficiency, and scalability; and (3) we release an easy-to-use and scalable (with distributed support) Python implementation for accessibility and reproducibility."
2201.00145,Matrix Decomposition and Applications,['Jun Lu'],ARXIV,http://arxiv.org/pdf/2201.00145v3,2022-01-01T08:13:48Z,2023-12-28T08:19:55Z,['10.48550/arXiv.2201.00145'],"In 1954, Alston S. Householder published Principles of Numerical Analysis, one of the first modern treatments on matrix decomposition that favored a (block) LU decomposition-the factorization of a matrix into the product of lower and upper triangular matrices. And now, matrix decomposition has become a core technology in machine learning, largely due to the development of the back propagation algorithm in fitting a neural network. The sole aim of this survey is to give a self-contained introduction to concepts and mathematical tools in numerical linear algebra and matrix analysis in order to seamlessly introduce matrix decomposition techniques and their applications in subsequent sections. However, we clearly realize our inability to cover all the useful and interesting results concerning matrix decomposition and given the paucity of scope to present this discussion, e.g., the separated analysis of the Euclidean space, Hermitian space, Hilbert space, and things in the complex domain. We refer the reader to literature in the field of linear algebra for a more detailed introduction to the related fields."
2201.00226,Simplicial Quantum Gravity,['James B. Hartle'],ARXIV,http://arxiv.org/pdf/2201.00226v2,2022-01-01T18:20:07Z,2022-01-25T22:07:04Z,['10.48550/arXiv.2201.00226'],Simplicial approximation and the ideas associated with the Regge calculus.provide a concrete way of implementing a sum over histories formulation ofquantum gravity. A four-dimensional simplicial geometry is made up of flat four-simplices joined together.A sum over simplicial geometries is a sum over thedifferent ways the simplices can be joined together with an integral over their edge lengths.Theconstruction of the simplicial Euclidean action for this approach to quantum general relativity is illustrated. The recovery of the diffeomorphism group in the continuum limit is discussed. Some possible classes of simplicial complexes with which to define a sum over topologies are described.
2201.00144,Negative Imaginary Systems Theory for Nonlinear Systems: A Dissipativity Approach,"['Ahmed G. Ghallab', 'Ian R. Petersen']",ARXIV,http://arxiv.org/pdf/2201.00144v1,2022-01-01T08:10:55Z,2022-01-01T08:10:55Z,['10.48550/arXiv.2201.00144'],"Negative imaginary (NI) systems theory is a well-established system theoretic framework for analysis and design of linear-time-invariant (LTI) control systems. In this paper, we aim to generalize negative imaginary systems theory to a class of nonlinear systems. Based on the time domain interpretation of the NI property for LTI systems, a formal definition in terms of a dissipativity with an appropriate work rate will be used to define the nonlinear negative imaginary (NNI) property for a general nonlinear system. Mechanical systems with force actuators and position sensors are nonlinear negative imaginary according to this new definition. Using Lyapunov stability theory, we seek to establish a nonlinear generalization of the NI robust stability result for positive feedback interconnections of NNI systems. An example of a nonlinear mass-spring-damper system with force as input and displacement of the mass as output will be presented to illustrate the applicability of the NNI stability result. Furthermore, the case of NI systems with free motion will be investigated in the nonlinear domain based on the dissipativity framework of NNI systems."
2201.00137,Sum-of-Squares Program and Safe Learning On Maximizing the Region of Attraction of Partially Unknown Systems,"['Dongkun Han', 'Hejun Huang']",ARXIV,http://arxiv.org/pdf/2201.00137v1,2022-01-01T07:13:59Z,2022-01-01T07:13:59Z,['10.48550/arXiv.2201.00137'],"Recent advances in learning techniques have enabled the modelling of unknown dynamical systems directly from data. However, in many contexts, these learning-based methods are short of safety guarantee and strict stability verification. To address this issue, this paper first approximates the partially unknown nonlinear systems by using a learned state space with Gaussian Processes and Chebyshev interpolants. A Sum-of-Squares Programming based approach is then proposed to synthesize a controller by searching an optimal control Lyapunov Barrier function. In this way, we maximize the estimated region of attraction of partially unknown nonlinear systems, while guaranteeing both safety and stability. It is shown that the proposed method improves the extrapolation performance, and at the same time, generates a significantly larger estimated region of attraction."
2201.00435,Transfer-learning-based Surrogate Model for Thermal Conductivity of Nanofluids,"['Saeel S. Pai', 'Abhijeet Banthiya']",ARXIV,http://arxiv.org/pdf/2201.00435v1,2022-01-02T23:55:12Z,2022-01-02T23:55:12Z,['10.48550/arXiv.2201.00435'],"Heat transfer characteristics of nanofluids have been extensively studied since the 1990s. Research investigations show that the suspended nanoparticles significantly alter the suspension's thermal properties. The thermal conductivity of nanofluids is one of the properties that is generally found to be greater than that of the base fluid. This increase in thermal conductivity is found to depend on several parameters. Several theories have been proposed to model the thermal conductivities of nanofluids, but there is no reliable universal theory yet to model the anomalous thermal conductivity of nanofluids. In recent years, supervised data-driven methods have been successfully employed to create surrogate models across various scientific disciplines, especially for modeling difficult-to-understand phenomena. These supervised learning methods allow the models to capture highly non-linear phenomena. In this work, we have taken advantage of existing correlations and used them concurrently with available experimental results to develop more robust surrogate models for predicting the thermal conductivity of nanofluids. Artificial neural networks are trained using the transfer learning approach to predict the thermal conductivity enhancement of nanofluids with spherical particles for 32 different particle-fluid combinations (8 particles materials and 4 fluids). The large amount of lower accuracy data generated from correlations is used to coarse-tune the model parameters, and the limited amount of more trustworthy experimental data is used to fine-tune the model parameters. The transfer learning-based models' results are compared with those from baseline models which are trained only on experimental data using a goodness of fit metric. It is found that the transfer learning models perform better with goodness of fit values of 0.93 as opposed to 0.83 from the baseline models."
2201.00203,NOMA Computation Over Multi-Access Channels for Multimodal Sensing,"['Michel Kulhandjian', 'Gunes Karabulut Kurt', 'Hovannes Kulhandjian', 'Halim Yanikomeroglu', ""Claude D'Amours""]",ARXIV,http://arxiv.org/pdf/2201.00203v1,2022-01-01T15:04:26Z,2022-01-01T15:04:26Z,['10.48550/arXiv.2201.00203'],"An improved mean squared error (MSE) minimization solution based on eigenvector decomposition approach is conceived for wideband non-orthogonal multiple-access based computation over multi-access channel (NOMA-CoMAC) framework. This work aims at further developing NOMA-CoMAC for next-generation multimodal sensor networks, where a multimodal sensor monitors several environmental parameters such as temperature, pollution, humidity, or pressure. We demonstrate that our proposed scheme achieves an MSE value approximately 0.7 lower at E_b/N_o = 1 dB in comparison to that for the average sum-channel based method. Moreover, the MSE performance gain of our proposed solution increases even more for larger values of subcarriers and sensor nodes due to the benefit of the diversity gain. This, in return, suggests that our proposed scheme is eminently suitable for multimodal sensor networks."
