arxiv_id,title,authors,src,url,pub_date,upd_date,doi,abstract
2201.00122,A Relaxed Energy Function Based Analog Neural Network Approach to Target Localization in Distributed MIMO Radar,"['Xiaoyu Zhao', 'Jun Li', 'Qinghua Guo']",ARXIV,http://arxiv.org/pdf/2201.00122v2,2022-01-01T05:21:29Z,2022-10-19T08:55:15Z,['10.48550/arXiv.2201.00122'],"Analog neural networks are highly effective to solve some optimization problems, and they have been used for target localization in distributed multiple-input multiple-output (MIMO) radar. In this work, we design a new relaxed energy function based neural network (RNFNN) for target localization in distributed MIMO radar. We start with the maximum likelihood (ML) target localization with a complicated objective function, which can be transformed to a tractable one with equality constraints by introducing some auxiliary variables. Different from the existing Lagrangian programming neural network (LPNN) methods, we further relax the optimization problem formulated for target localization, so that the Lagrangian multiplier terms are no longer needed, leading to a relaxed energy function with better convexity. Based on the relaxed energy function, a RNFNN is implemented with much simpler structure and faster convergence speed. Furthermore, the RNFNN method is extended to localization in the presence of transmitter and receiver location errors. It is shown that the performance of the proposed localization approach achieves the Cram\'er-Rao lower bound (CRLB) within a wider range of signal-to-noise ratios (SNRs). Extensive comparisons with the state-of-the-art approaches are provided, which demonstrate the advantages of the proposed approach in terms of performance improvement and computational complexity (or convergence speed)."
2201.00125,"Feichtinger Conjectures, $R_\varepsilon$-Conjectures and Weaver's Conjectures for Banach spaces",['K. Mahesh Krishna'],ARXIV,http://arxiv.org/pdf/2201.00125v1,2022-01-01T05:52:51Z,2022-01-01T05:52:51Z,['10.48550/arXiv.2201.00125'],"Motivated from two decades old famous Feichtinger conjectures for frames, $R_\varepsilon$-conjecture and Weaver's conjecture for Hilbert spaces (and their solution by Marcus, Spielman, and Srivastava), we formulate Feichtinger conjectures for p-approximate Schauder frames, $R_\varepsilon$-conjecture, Weaver's conjectures and Akemann-Weaver conjectures for Banach spaces. We also formulate conjectures on p-approximate Schauder frames based on the results of Casazza for frames for Hilbert spaces. We state conjectures and problems for p-approximate Schauder frames based on fundamental inequality for frames for Hilbert spaces and scaling problem for Hilbert space frames. Based on Kothe-Lorch theorem for Riesz bases for Hilbert spaces, we formulate a problem for p-approximate Riesz bases for Banach spaces. We formulate dynamical sampling problem for p-approximate Schauder frames for Banach spaces. We ask phase retrieval problem and norm retrieval problem for p-approximate Schauder frames for Banach spaces. We also formulate discretization problem for continuous p-approximate Schauder frames."
2201.00185,Extremal total distance of graphs of given radius I,['Stijn Cambie'],ARXIV,http://arxiv.org/pdf/2201.00185v2,2022-01-01T13:09:25Z,2022-04-18T11:17:38Z,"['10.48550/arXiv.2201.00185', '10.1002/jgt.22644']","In 1984, Plesn\'{i}k determined the minimum total distance for given order and diameter and characterized the extremal graphs and digraphs. We prove the analog for given order and radius, when the order is sufficiently large compared to the radius. This confirms asymptotically a conjecture of Chen et al. We also state an analog of the conjecture of Chen et al for digraphs and prove it for sufficiently large order."
2201.00319,Modular Welch Bounds with Applications,['K. Mahesh Krishna'],ARXIV,http://arxiv.org/pdf/2201.00319v1,2022-01-02T08:45:38Z,2022-01-02T08:45:38Z,['10.48550/arXiv.2201.00319'],"We prove the following two results. \begin{enumerate} \item Let $\mathcal{A}$ be a unital commutative C*-algebra and $\mathcal{A}^d$ be the standard Hilbert C*-module over $\mathcal{A}$. Let $n\geq d$. If $\{\tau_j\}_{j=1}^n$ is any collection of vectors in $\mathcal{A}^d$ such that $\langle \tau_j, \tau_j \rangle =1$, $\forall 1\leq j \leq n$, then \begin{align*} \max _{1\leq j,k \leq n, j\neq k}\|\langle \tau_j, \tau_k\rangle ||^{2m}\geq \frac{1}{n-1}\left[\frac{n}{{d+m-1\choose m}}-1\right], \quad \forall m \in \mathbb{N}. \end{align*} \item Let $\mathcal{A}$ be a $\sigma$-finite commutative W*-algebra or a commutative AW*-algebra and $\mathcal{E}$ be a rank d Hilbert C*-module over $\mathcal{A}$. Let $n\geq d$. If $\{\tau_j\}_{j=1}^n$ is any collection of vectors in $\mathcal{E}$ such that $\langle \tau_j, \tau_j \rangle =1$, $\forall 1\leq j \leq n$, then \begin{align*} \max _{1\leq j,k \leq n, j\neq k}\|\langle \tau_j, \tau_k\rangle ||^{2m}\geq \frac{1}{n-1}\left[\frac{n}{{d+m-1\choose m}}-1\right], \quad \forall m \in \mathbb{N}. \end{align*} \end{enumerate} Results (1) and (2) reduce to the famous result of Welch [\textit{IEEE Transactions on Information Theory, 1974}] obtained 48 years ago. We introduce the notions of modular frame potential, modular equiangular frames and modular Grassmannian frames. We formulate Zauner's conjecture for Hilbert C*-modules."
2201.00332,Parameterizing and inverting analytic mappings with unit Jacobian,['Timur Sadykov'],ARXIV,http://arxiv.org/pdf/2201.00332v1,2022-01-02T10:43:32Z,2022-01-02T10:43:32Z,['10.48550/arXiv.2201.00332'],"Let $x=(x_1,\ldots,x_n)\in {\rm \bf C}^n$ be a vector of complex variables, denote by $A=(a_{jk})$ a square matrix of size $n\geq 2,$ and let $\varphi\in\mathcal{O}(\Omega)$ be an analytic function defined in a nonempty domain $\Omega\subset {\rm \bf C}.$ We investigate the family of mappings $$ f=(f_1,\ldots,f_n):{\rm \bf C}^n\rightarrow {\rm \bf C}^n, \quad f[A,\varphi](x):=x+\varphi(Ax) $$ with the coordinates $$ f_j : x \mapsto x_j + \varphi\left(\sum\limits_{k=1}^n a_{jk}x_k\right), \quad j=1,\ldots,n $$ whose Jacobian is identically equal to a nonzero constant for any $x$ such that all of $f_j$ are well-defined. Let $U$ be a square matrix such that the Jacobian of the mapping $f[U,\varphi](x)$ is a nonzero constant for any $x$ and moreover for any analytic function $\varphi\in\mathcal{O}(\Omega).$ We show that any such matrix $U$ is uniquely defined, up to a suitable permutation similarity of matrices, by a partition of the dimension $n$ into a sum of $m$ positive integers together with a permutation on $m$ elements. For any $d=2,3,\ldots$ we construct $n$-parametric family of square matrices $H(s), s\in {\rm \bf C}^n$ such that for any matrix $U$ as above the mapping $x+\left((U\odot H(s))x\right)^d$ defined by the Hadamard product $U\odot H(s)$ has unit Jacobian. We prove any such mapping to be polynomially invertible and provide an explicit recursive formula for its inverse."
2201.00303,"Changing Computer-Usage Behaviours: What Users Want, Use, and Experience","['Mina Khan', 'Zeel Patel', 'Kathryn Wantlin', 'Elena Glassman', 'Pattie Maes']",ARXIV,http://arxiv.org/pdf/2201.00303v1,2022-01-02T06:28:18Z,2022-01-02T06:28:18Z,"['10.48550/arXiv.2201.00303', '10.1145/3429360.3468180']","Technology based screentime, the time an individual spends engaging with their computer or cell phone, has increased exponentially over the past decade, but perhaps most alarmingly amidst the COVID-19 pandemic. Although many software based interventions exist to reduce screentime, users report a variety of issues relating to the timing of the intervention, the strictness of the tool, and its ability to encourage organic, long-term habit formation. We develop guidelines for the design of behaviour intervention software by conducting a survey to investigate three research questions and further inform the mechanisms of computer-related behaviour change applications. RQ1: What do people want to change and why/how? RQ2: What applications do people use or have used, why do they work or not, and what additional support is desired? RQ3: What are helpful/unhelpful computer breaks and why? Our survey had 68 participants and three key findings. First, time management is a primary concern, but emotional and physical side-effects are equally important. Second, site blockers, self-trackers, and timers are commonly used, but they are ineffective as they are easy-to-ignore and not personalized. Third, away-from-computer breaks, especially involving physical activity, are helpful, whereas on-screen breaks are unhelpful, especially when they are long, because they are not refreshing. We recommend personalized and closed-loop computer-usage behaviour change support and especially encouraging off-the-computer screentime breaks."
2201.00410,Thresholds and more bands of A.C. spectrum for the Molchanov--Vainberg Schrödinger operator with a more general long range condition,['Marc-Adrien Mandich'],ARXIV,http://arxiv.org/pdf/2201.00410v1,2022-01-02T20:06:29Z,2022-01-02T20:06:29Z,['10.48550/arXiv.2201.00410'],"The existence of absolutely continuous (a.c.) spectrum for the discrete Molchanov-Vainberg Schr\""odinger operator $D+V$ on $\ell^2(\mathbb{Z}^d)$, in dimensions $d\geq 2$, is further investigated for potentials $V$ satisfying the long range condition $n_i(V-\tau_i ^{\kappa}V)(n) = O(\ln^{-q}(|n|))$ for some $q>2$, $\kappa \in \mathbb{N}$ even, and all $1 \leq i \leq d$, as $|n| \to \infty$. $\tau_i ^{\kappa} V$ is the potential shifted by $\kappa$ units on the $i^{\text{th}}$ coordinate. In this article \textit{finite} linear combinations of conjugate operators are constructed. These lead to more bands of a.c.\ spectrum being found. However, the new bands of a.c. spectrum are justified mainly by graphical evidence because the coefficients of the linear combinations are obtained by numerical polynomial interpolation. At the same time, an infinitely countable set of thresholds is rigorously identified (these will be defined exactly in the article). We conjecture that the spectrum of $D+V$ in dimension 2 is void of singular continuous spectrum, and that consecutive thresholds constitute endpoints of a band of a.c. spectrum."
2201.00353,Anisotropic versions of the Brezis-Van Schaftingen-Yung approach at $s=1$ and $s=0$,"['Qingsong Gu', 'Qingzhong Huang']",ARXIV,http://arxiv.org/pdf/2201.00353v1,2022-01-02T13:06:27Z,2022-01-02T13:06:27Z,['10.48550/arXiv.2201.00353'],"In 2014, Ludwig showed the limiting behavior of the anisotropic Gagliardo $s$-seminorm of a function $f$ as $s\rightarrow 1^-$ and $s\rightarrow0^+$, which extend the results due to Bourgain-Brezis-Mironescu(BBM) and Maz'ya-Shaposhnikova(MS) respectively. Recently, Brezis, Van Schaftingen and Yung provided a different approach by replacing the strong $L^p$ norm in the Gagliardo $s$-seminorm by the weak $L^p$ quasinorm. They characterized the case for $s=1$ that complements the BBM formula. The corresponding MS formula for $s=0$ was later established by Yung and the first author. In this paper, we follow the approach of Brezis-Van Schaftingen-Yung and show the anisotropic versions of $s=1$ and $s=0$. Our result generalizes the work by Brezis, Van Schaftingen, Yung and the first author and complements the work by Ludwig."
2201.00119,Limiting Spectral Distribution of High-dimensional Hayashi-Yoshida Estimator of Integrated Covariance Matrix,"['Arnab Chakrabarti', 'Rituparna Sen']",ARXIV,http://arxiv.org/pdf/2201.00119v1,2022-01-01T05:17:39Z,2022-01-01T05:17:39Z,['10.48550/arXiv.2201.00119'],"In this paper, the estimation of the Integrated Covariance matrix from high-frequency data, for high dimensional stock price process, is considered. The Hayashi-Yoshida covolatility estimator is an improvement over Realized covolatility for asynchronous data and works well in low dimensions. However it becomes inconsistent and unreliable in the high dimensional situation. We study the bulk spectrum of this matrix and establish its connection to the spectrum of the true covariance matrix in the limiting case where the dimension goes to infinity. The results are illustrated with simulation studies in finite, but high, dimensional cases. An application to real data with tick-by-tick data on 50 stocks is presented."
2201.00315,Energy evolution of the overlap functions: increasing ratio of $σ_{el}(s)/σ_{tot}(s)$ and black ring emergence,"['S. M. Troshin', 'N. E. Tyurin']",ARXIV,http://arxiv.org/pdf/2201.00315v3,2022-01-02T07:43:24Z,2022-09-06T07:49:59Z,"['10.48550/arXiv.2201.00315', '10.1088/1361-6471/ac8f60']",We analyse the two possible options of the energy dependency of the elastic and inelastic overlap functions. These correspond to saturation of the black disk limit (BEL effect) and to the unitarity saturation (REL effect) at $s\to\infty$. Relation of the REL effect to increase of the ratio $\sigma_{el}(s)/\sigma_{tot}(s)$ and emergence of black ring picture at the LHC is underlined.
2201.00274,COVID Lessons: Was there any way to reduce the negative effect of COVID-19 on the United States economy?,['Mohammadreza Mahmoudi'],ARXIV,http://arxiv.org/pdf/2201.00274v1,2022-01-02T02:25:34Z,2022-01-02T02:25:34Z,['10.48550/arXiv.2201.00274'],"This paper aims to study the economic impact of COVID-19. To do that, in the first step, I showed that the adjusted SEQIER model, which is a generalization form of SEIR model, is a good fit to the real COVID-induced daily death data in a way that it could capture the nonlinearities of the data very well. Then, I used this model with extra parameters to evaluate the economic effect of COVID-19 through job market. The results show that there was a simple strategy that US government could implemented in order to reduce the negative effect of COVID-19. Because of that the answer to the paper's title is yes. If lockdown policies consider the heterogenous characteristics of population and impose more restrictions on old people and control the interactions between them and the rest of population the devastating impact of COVID-19 on people lives and US economy reduced dramatically. Specifically, based on this paper's results, this strategy could reduce the death rate and GDP loss of the United States 0.03 percent and 2 percent respectively. By comparing these results with actual data which show death rate and GDP loss 0.1 percent and 3.5 percent respectively, we could figure out that death rate reduction is 0.07 percent which means for the same percent of GDP loss executing optimal targeted policy could save 2/3 lives. Approximately, 378,000 persons dead because of COVID-19 during 2020, hence reducing death rate to 0.03 percent means saving around 280,000 lives, which is huge."
2201.00136,Zero-shot Commonsense Question Answering with Cloze Translation and Consistency Optimization,"['Zi-Yi Dou', 'Nanyun Peng']",ARXIV,http://arxiv.org/pdf/2201.00136v1,2022-01-01T07:12:49Z,2022-01-01T07:12:49Z,['10.48550/arXiv.2201.00136'],"Commonsense question answering (CQA) aims to test if models can answer questions regarding commonsense knowledge that everyone knows. Prior works that incorporate external knowledge bases have shown promising results, but knowledge bases are expensive to construct and are often limited to a fixed set of relations. In this paper, we instead focus on better utilizing the \textit{implicit knowledge} stored in pre-trained language models. While researchers have found that the knowledge embedded in pre-trained language models can be extracted by having them fill in the blanks of carefully designed prompts for relation extraction and text classification, it remains unclear if we can adopt this paradigm in CQA where the inputs and outputs take much more flexible forms. To this end, we investigate four translation methods that can translate natural questions into cloze-style sentences to better solicit commonsense knowledge from language models, including a syntactic-based model, an unsupervised neural model, and two supervised neural models. In addition, to combine the different translation methods, we propose to encourage consistency among model predictions on different translated questions with unlabeled data. We demonstrate the effectiveness of our methods on three CQA datasets in zero-shot settings. We show that our methods are complementary to a knowledge base improved model, and combining them can lead to state-of-the-art zero-shot performance. Analyses also reveal distinct characteristics of the different cloze translation methods and provide insights on why combining them can lead to great improvements."
2201.00497,Criteria for Starlikeness Using Schwarzian Derivatives,"['Asha Sebastian', 'V. Ravichandran']",ARXIV,http://arxiv.org/pdf/2201.00497v1,2022-01-03T06:49:38Z,2022-01-03T06:49:38Z,['10.48550/arXiv.2201.00497'],"For a normalised analytic function f defined on the open unit disk in the complex plane, we determine several sufficient conditions for starlikeness in terms of the quotients Q_{ST}:=zf'(z)/f(z), Q_{CV}:=1+zf""(z)/f'(z) and the Schwarzian derivative Q_{SD}:=z^2((f""(z)/f'(z))'-(f""(z)/f'(z))^2/2)$. These conditions were obtained by using the admissibility criteria of starlikeness in the theory of second order differential subordination."
2201.00498,Variational Inverting Network for Statistical Inverse Problems of Partial Differential Equations,"['Junxiong Jia', 'Yanni Wu', 'Peijun Li', 'Deyu Meng']",ARXIV,http://arxiv.org/pdf/2201.00498v2,2022-01-03T06:56:52Z,2023-07-31T08:16:24Z,['10.48550/arXiv.2201.00498'],"To quantify uncertainties in inverse problems of partial differential equations (PDEs), we formulate them into statistical inference problems using Bayes' formula. Recently, well-justified infinite-dimensional Bayesian analysis methods have been developed to construct dimension-independent algorithms. However, there are three challenges for these infinite-dimensional Bayesian methods: prior measures usually act as regularizers and are not able to incorporate prior information efficiently; complex noises, such as more practical non-i.i.d. distributed noises, are rarely considered; and time-consuming forward PDE solvers are needed to estimate posterior statistical quantities. To address these issues, an infinite-dimensional inference framework has been proposed based on the infinite-dimensional variational inference method and deep generative models. Specifically, by introducing some measure equivalence assumptions, we derive the evidence lower bound in the infinite-dimensional setting and provide possible parametric strategies that yield a general inference framework called the Variational Inverting Network (VINet). This inference framework can encode prior and noise information from learning examples. In addition, relying on the power of deep neural networks, the posterior mean and variance can be efficiently and explicitly generated in the inference stage. In numerical experiments, we design specific network structures that yield a computable VINet from the general inference framework. Numerical examples of linear inverse problems of an elliptic equation and the Helmholtz equation are presented to illustrate the effectiveness of the proposed inference framework."
2201.00171,Multi-view Subspace Adaptive Learning via Autoencoder and Attention,"['Jian-wei Liu', 'Hao-jie Xie', 'Run-kun Lu', 'Xiong-lin Luo']",ARXIV,http://arxiv.org/pdf/2201.00171v1,2022-01-01T11:31:52Z,2022-01-01T11:31:52Z,['10.48550/arXiv.2201.00171'],"Multi-view learning can cover all features of data samples more comprehensively, so multi-view learning has attracted widespread attention. Traditional subspace clustering methods, such as sparse subspace clustering (SSC) and low-ranking subspace clustering (LRSC), cluster the affinity matrix for a single view, thus ignoring the problem of fusion between views. In our article, we propose a new Multiview Subspace Adaptive Learning based on Attention and Autoencoder (MSALAA). This method combines a deep autoencoder and a method for aligning the self-representations of various views in Multi-view Low-Rank Sparse Subspace Clustering (MLRSSC), which can not only increase the capability to non-linearity fitting, but also can meets the principles of consistency and complementarity of multi-view learning. We empirically observe significant improvement over existing baseline methods on six real-life datasets."
2201.00307,Reflectionless wave propagation on shallow water with variable bathymetry and current. II,"['Semyon M. Churilov', 'Yury A. Stepanyants']",ARXIV,http://arxiv.org/pdf/2201.00307v1,2022-01-02T06:39:34Z,2022-01-02T06:39:34Z,"['10.48550/arXiv.2201.00307', '10.1017/jfm.2022.208']","We show that in the linear approximation there are three classes of reflectionless wave propagation on a surface of shallow water in the channel with spatially varying depth, width, and current speed. Two of these classes have been described in our previous paper (Churilov & Stepanyants, 2022), and the third one was discovered recently and is described here. The general analysis of the problem shows that within the approach used in both our papers, these three classes, apparently, exhaust all possible cases of exact solutions of the problem considered. We show that the reflectionless flow can be global at certain conditions, i.e. it can exist on the entire x-axis. There are also reflectionless flows which exist only on the limited intervals of the x-axis."
2201.00143,Large deviations principle for stochastic delay differential equations with super-linearly growing coefficients,"['Diancong Jin', 'Ziheng Chen', 'Tau Zhou']",ARXIV,http://arxiv.org/pdf/2201.00143v1,2022-01-01T08:02:39Z,2022-01-01T08:02:39Z,['10.48550/arXiv.2201.00143'],"We utilize the weak convergence method to establish the Freidlin--Wentzell large deviations principle (LDP) for stochastic delay differential equations (SDDEs) with super-linearly growing coefficients, which covers a large class of cases with non-globally Lipschitz coefficients. The key ingredient in our proof is the uniform moment estimate of the controlled equation, where we handle the super-linear growth of the coefficients by an iterative argument. Our results allow both the drift and diffusion coefficients of the considered equations to super-linearly grow not only with respect to the delay variable but also to the state variable. This work extends the existing results which develop the LDPs for SDDEs with super-linearly growing coefficients only with respect to the delay variable."
2201.00466,RFormer: Transformer-based Generative Adversarial Network for Real Fundus Image Restoration on A New Clinical Benchmark,"['Zhuo Deng', 'Yuanhao Cai', 'Lu Chen', 'Zheng Gong', 'Qiqi Bao', 'Xue Yao', 'Dong Fang', 'Shaochong Zhang', 'Lan Ma']",ARXIV,http://arxiv.org/pdf/2201.00466v2,2022-01-03T03:56:58Z,2022-08-03T11:54:27Z,['10.48550/arXiv.2201.00466'],"Ophthalmologists have used fundus images to screen and diagnose eye diseases. However, different equipments and ophthalmologists pose large variations to the quality of fundus images. Low-quality (LQ) degraded fundus images easily lead to uncertainty in clinical screening and generally increase the risk of misdiagnosis. Thus, real fundus image restoration is worth studying. Unfortunately, real clinical benchmark has not been explored for this task so far. In this paper, we investigate the real clinical fundus image restoration problem. Firstly, We establish a clinical dataset, Real Fundus (RF), including 120 low- and high-quality (HQ) image pairs. Then we propose a novel Transformer-based Generative Adversarial Network (RFormer) to restore the real degradation of clinical fundus images. The key component in our network is the Window-based Self-Attention Block (WSAB) which captures non-local self-similarity and long-range dependencies. To produce more visually pleasant results, a Transformer-based discriminator is introduced. Extensive experiments on our clinical benchmark show that the proposed RFormer significantly outperforms the state-of-the-art (SOTA) methods. In addition, experiments of downstream tasks such as vessel segmentation and optic disc/cup detection demonstrate that our proposed RFormer benefits clinical fundus image analysis and applications. The dataset, code, and models are publicly available at https://github.com/dengzhuo-AI/Real-Fundus"
2201.00333,OPE of line defects in 5d $E_n$ SCFT,['Jihwan Oh'],ARXIV,http://arxiv.org/pdf/2201.00333v1,2022-01-02T10:48:10Z,2022-01-02T10:48:10Z,"['10.48550/arXiv.2201.00333', '10.1007/JHEP03(2022)178']","5d ray index is the 5d superconformal index in the presence of a ray-like defect. An elementary ray defect flows to a fundamental Wilson ray in IR gauge theory. In 5d $\mathcal{N}=1$ superconformal field theory(SCFT) with $E_n$ global symmetry, we compute the ray index associated with an adjoint Wilson ray. We show that the operators that appear in the index are non-trivially charged under the center of the global symmetry $E_n$. The charge under the center being twice compared with the center charge carried by the elementary ray operator indicates a non-trivial OPE between the ray-like defects in the UV SCFT."
2201.00209,Cobordism invariants for knots with two indices,['Vassily Olegovich Manturov'],ARXIV,http://arxiv.org/pdf/2201.00209v1,2022-01-01T15:28:27Z,2022-01-01T15:28:27Z,['10.48550/arXiv.2201.00209'],We construct an invariant of virtual knots which is a sliceness obstruction and sensitive to the $\Delta$-move. This invariants works if $\Z_{2}\oplus \Z_{2}$-index of chords is present.
