arxiv_id,title,authors,src,url,pub_date,upd_date,doi,abstract
2201.00155,Adaptive Single Image Deblurring,"['Maitreya Suin', 'Kuldeep Purohit', 'A. N. Rajagopalan']",ARXIV,http://arxiv.org/pdf/2201.00155v1,2022-01-01T10:10:19Z,2022-01-01T10:10:19Z,['10.48550/arXiv.2201.00155'],"This paper tackles the problem of dynamic scene deblurring. Although end-to-end fully convolutional designs have recently advanced the state-of-the-art in non-uniform motion deblurring, their performance-complexity trade-off is still sub-optimal. Existing approaches achieve a large receptive field by a simple increment in the number of generic convolution layers, kernel-size, which comes with the burden of the increase in model size and inference speed. In this work, we propose an efficient pixel adaptive and feature attentive design for handling large blur variations within and across different images. We also propose an effective content-aware global-local filtering module that significantly improves the performance by considering not only the global dependencies of the pixel but also dynamically using the neighboring pixels. We use a patch hierarchical attentive architecture composed of the above module that implicitly discover the spatial variations in the blur present in the input image and in turn perform local and global modulation of intermediate features. Extensive qualitative and quantitative comparisons with prior art on deblurring benchmarks demonstrate the superiority of the proposed network."
2201.00499,Quantum electrodynamic effects on counter-streaming instabilities in the whole \textbf{k} space,['Antoine Bret'],ARXIV,http://arxiv.org/pdf/2201.00499v1,2022-01-03T07:02:47Z,2022-01-03T07:02:47Z,"['10.48550/arXiv.2201.00499', '10.1103/PhysRevE.105.015205']","In a recent work [Bret, EPL \textbf{135} (2021) 35001], quantum electrodynamic (QED) effects were evaluated for the two-stream instability. It pertains to the growth of perturbations with a wave vector oriented along the flow in a collisionless counter-streaming system. Here, the analysis is extended to every possible orientation of the wave vector. The previous result for the two-stream instability is recovered, and it is proved that even within the framework of a 3D analysis, this instability remains fundamentally 1D even when accounting for QED effects. The filamentation instability, found for wave vectors normal to the flow, is weakly affected by QED corrections. As in the classical case, its growth rate saturates at large $k_\perp$. The saturation value is found independent of QED corrections. Also, the smallest unstable $k_\perp$ is independent of QED corrections. Surprisingly, unstable modes found for oblique wave vectors do \emph{not} follow the same pattern. For some, QED corrections do reduce the growth rate. But for others, the same corrections increase the growth rate instead. The possibility for QED effects to play a role in un-magnetized systems is evaluated. Pair production resulting from gamma emission by particles oscillating in the exponentially growing fields, is not accounting for."
2201.00214,Temperature Analysis of Flaring (AR11283) and non-Flaring (AR12194) Coronal Loops,"['Narges Fathalian', 'Seyedeh Somayeh Hosseini Rad', 'Nasibeh Alipour', 'Hossein Safari']",ARXIV,http://arxiv.org/pdf/2201.00214v1,2022-01-01T16:14:57Z,2022-01-01T16:14:57Z,"['10.48550/arXiv.2201.00214', '10.1088/1674-4527/ac47ac']","Here, we study the temperature structure of flaring and non-flaring coronal loops, using extracted loops from images taken in six extreme ultraviolet (EUV) channels recorded by Atmospheric Imaging Assembly (AIA)/ Solar Dynamic Observatory (SDO). We use data for loops of X2.1-class-flaring active region (AR11283) during 22:10UT till 23:00UT, on 2011, September 6; and non-flaring active region (AR12194) during 08:00:00UT till 09:00:00UT on 2014, October 26. By using spatially-synthesized Gaussian DEM forward-fitting method, we calculate the peak temperatures for each strip of the loops. We apply the Lomb-Scargle method to compute the oscillations periods for the temperature series of each strip. The periods of the temperature oscillations for the flaring loops are ranged from 7 min to 28.4 min. These temperature oscillations show very close behavior to the slow-mode oscillation. We observe that the temperature oscillations in the flaring loops are started at least around 10 minutes before the transverse oscillations and continue for a long time duration even after the transverse oscillations are ended. The temperature amplitudes are increased at the flaring time (during 20 min) in the flaring loops. The periods of the temperatures obtained for the non-flaring loops are ranged from 8.5 min to 30 min, but their significances are less (below 0.5) in comparison with the flaring ones (near to one). Hence the detected temperature periods for the non-flaring loops' strips are less probable in comparison with the flaring ones, and maybe they are just fluctuations. Based on our confined observations, it seems that the flaring loops' periods show more diversity and their temperatures have wider ranges of variation than the non-flaring ones. More accurate commentary in this respect requires more extensive statistical research and broader observations."
2201.00216,The Pomeron -- A Bootstrap Story,['Chung-I Tan'],ARXIV,http://arxiv.org/pdf/2201.00216v1,2022-01-01T16:29:39Z,2022-01-01T16:29:39Z,['10.48550/arXiv.2201.00216'],"In a contribution to the volume {\it A Passion for Physics}, a collection of essays in honor of Geoffrey Chew's sixtieth birthday, I wrote, together with A. Capella, Uday Sukhatme, and Tran Thanh Van {\it The Pomeron Story.} This is a follow-up to that contribution. This sequel also serves as an opportunity to acknowledge my gratitude to Geoff as a PhD student under his tutelage."
2201.00295,Radio Pulsar Sub-Populations (II) : The Mysterious RRATs,"[' Abhishek', 'Namrata Malusare', 'Tanushree N', 'Gayathri Hegde', 'Sushan Konar']",ARXIV,http://arxiv.org/pdf/2201.00295v2,2022-01-02T05:27:33Z,2022-05-04T12:05:01Z,['10.48550/arXiv.2201.00295'],"Several conjectures have been put forward to explain the RRATs, the newest subclass of neutron stars, and their connections to other radio pulsars. This work discusses these conjectures in the context of the characteristic properties of the RRAT population. Contrary to expectations, it is seen that - a) the RRAT population is statistically un-correlated with the nulling pulsars, and b) the RRAT phenomenon is unlikely to be related to old age or death-line proximity. It is perhaps more likely that the special emission property of RRATs is a signature of them being later evolutionary phases of other types of neutron stars which may have resulted in restructuring of the magnetic fields."
2201.00182,On the representativeness of approximate solutions of discrete optimization problems with interval objective function,['Alexander Prolubnikov'],ARXIV,http://arxiv.org/pdf/2201.00182v2,2022-01-01T12:54:07Z,2022-06-18T12:10:43Z,['10.48550/arXiv.2201.00182'],"We consider discrete optimization problems with interval uncertatinty of objective function coefficients. The interval uncertainty models measurements errors. A pos\-sible optimal solution is a solution that is optimal for some possible values of the coefficients. Pro\-ba\-bi\-li\-ty of a possible solution is the probability to obtain such coefficients that the solution is optimal. Similarly we define the notion of a possible approximate solution with given accuracy and probability of the solution. A possible approximate solution is an approximate solution that is obtained for some possible values of the coefficients by some fixed approximate algorithm, e.g. by the greedy algorithm. Pro\-ba\-bi\-li\-ty of a such solution is the probability to obtain such coefficients that the algorithm produces the solution as its output. We consider optimal or approximate possible solution un\-re\-pre\-sen\-ta\-ti\-ve if its probability less than some boundary value. The mean approximate solution is a possible approximate solution for midpoints of the coefficients intervals. The solution may be treated as approximate solution for exact values of the coefficients. We show that the share of individual discrete optimization problems instances with unrepresentative mean approximate solution may be wide enough for rather small values of error and the boundary value. The same is true for any other possible approximate solution: all of them may be unrepresentative."
2201.00173,Nonlinear Anderson localized states at arbitrary disorder,"['Wencai Liu', 'W. -M. Wang']",ARXIV,http://arxiv.org/pdf/2201.00173v1,2022-01-01T11:49:27Z,2022-01-01T11:49:27Z,['10.48550/arXiv.2201.00173'],"It is classical, following Furstenberg's theorem on positive Lyapunov exponent for products of random SL$(2, \mathbb R)$ matrices, that the one dimensional random Schr\""odinger operator has Anderson localization at arbitrary disorder. This paper proves a nonlinear analogue, thereby establishing a KAM-type persistence result for a non-integrable system."
2201.00304,Informed Multi-context Entity Alignment,"['Kexuan Xin', 'Zequn Sun', 'Wen Hua', 'Wei Hu', 'Xiaofang Zhou']",ARXIV,http://arxiv.org/pdf/2201.00304v1,2022-01-02T06:29:30Z,2022-01-02T06:29:30Z,"['10.48550/arXiv.2201.00304', '10.1145/3488560.3498523']","Entity alignment is a crucial step in integrating knowledge graphs (KGs) from multiple sources. Previous attempts at entity alignment have explored different KG structures, such as neighborhood-based and path-based contexts, to learn entity embeddings, but they are limited in capturing the multi-context features. Moreover, most approaches directly utilize the embedding similarity to determine entity alignment without considering the global interaction among entities and relations. In this work, we propose an Informed Multi-context Entity Alignment (IMEA) model to address these issues. In particular, we introduce Transformer to flexibly capture the relation, path, and neighborhood contexts, and design holistic reasoning to estimate alignment probabilities based on both embedding similarity and the relation/entity functionality. The alignment evidence obtained from holistic reasoning is further injected back into the Transformer via the proposed soft label editing to inform embedding learning. Experimental results on several benchmark datasets demonstrate the superiority of our IMEA model compared with existing state-of-the-art entity alignment methods."
2201.00164,The differential role of verbal and visuospatial working memory in mathematics and reading,"['David Giofrè', 'Enrica Donolato', 'Irene C. Mammarella']",ARXIV,http://arxiv.org/pdf/2201.00164v1,2022-01-01T10:53:17Z,2022-01-01T10:53:17Z,"['10.48550/arXiv.2201.00164', '10.1016/j.tine.2018.07.001']","Objectives: Several studies have focused on the role of working memory (WM) in predicting mathematical and reading literacy. Alternative models of WM have been proposed and a modality-dependent model of WM, distinguishing between verbal and visuospatial WM modalities, has been advanced. In addition, the relationship between verbal and visuospatial WM and academic achievement has not been extensively and consistently studied, especially when it comes to distinguishing between mathematical and reading tasks. Method: In the present study, we tested a large group of middle school children in several measures of WM, and in mathematical and reading tasks. Results: Confirmatory factor analyses showed that verbal and visuospatial WM can be differentiated and that these factors have a different predictive power in explaining unique portions of variance in reading and mathematics. Conclusions: Our findings point to the importance of distinguishing between WM modalities in evaluating the relationship between mathematics and reading."
2201.00308,"DiffuseVAE: Efficient, Controllable and High-Fidelity Generation from Low-Dimensional Latents","['Kushagra Pandey', 'Avideep Mukherjee', 'Piyush Rai', 'Abhishek Kumar']",ARXIV,http://arxiv.org/pdf/2201.00308v3,2022-01-02T06:44:23Z,2022-11-29T07:18:50Z,['10.48550/arXiv.2201.00308'],"Diffusion probabilistic models have been shown to generate state-of-the-art results on several competitive image synthesis benchmarks but lack a low-dimensional, interpretable latent space, and are slow at generation. On the other hand, standard Variational Autoencoders (VAEs) typically have access to a low-dimensional latent space but exhibit poor sample quality. We present DiffuseVAE, a novel generative framework that integrates VAE within a diffusion model framework, and leverage this to design novel conditional parameterizations for diffusion models. We show that the resulting model equips diffusion models with a low-dimensional VAE inferred latent code which can be used for downstream tasks like controllable synthesis. The proposed method also improves upon the speed vs quality tradeoff exhibited in standard unconditional DDPM/DDIM models (for instance, FID of 16.47 vs 34.36 using a standard DDIM on the CelebA-HQ-128 benchmark using T=10 reverse process steps) without having explicitly trained for such an objective. Furthermore, the proposed model exhibits synthesis quality comparable to state-of-the-art models on standard image synthesis benchmarks like CIFAR-10 and CelebA-64 while outperforming most existing VAE-based methods. Lastly, we show that the proposed method exhibits inherent generalization to different types of noise in the conditioning signal. For reproducibility, our source code is publicly available at https://github.com/kpandey008/DiffuseVAE."
2201.00158,"$PT$-symmetric non-Hermitian Hamiltonian and invariant operator in periodically driven $SU(1,1)$ system","['Yan Gu', 'Xue-Min Bai', 'Xiao-Lei Hao', 'J. -Q. Liang']",ARXIV,http://arxiv.org/pdf/2201.00158v1,2022-01-01T10:30:22Z,2022-01-01T10:30:22Z,['10.48550/arXiv.2201.00158'],"We study in this paper the time evolution of $PT$-symmetric non-Hermitian Hamiltonian consisting of periodically driven $SU(1,1)$ generators. A non-Hermitian invariant operator is adopted to solve the Schr\""{o}dinger equation, since the time-dependent Hamiltonian is no longer a conserved quantity. We propose a scheme to construct the non-Hermitian invariant with a $PT$-symmetric but non-unitary transformation operator. The eigenstates of invariant and its complex conjugate form a bi-orthogonal basis to formulate the exact solution. We obtain the non-adiabatic Berry phase, which reduces to the adiabatic one in the slow time-variation limit. A non-unitary time-evolution operator is found analytically. As an consequence of the non-unitarity the ket ($|\psi (t)\rangle $) and bra ($\langle \psi (t)|$) states are not normalized each other. While the inner product of two states can be evaluated with the help of a metric operator. It is shown explicitly that the model can be realized by a periodically driven oscillator."
2201.00213,Resilience and inequality growth monitoring after disaster using indicators based on energy production,['Julien Gargani'],ARXIV,http://arxiv.org/pdf/2201.00213v1,2022-01-01T15:42:14Z,2022-01-01T15:42:14Z,['10.48550/arXiv.2201.00213'],"The estimation of resilience and the determination of inequality growth after a disaster is often difficult. In this study, specific indicators were developed to analyze resilience, and the trajectories of resilience were compared. Energy production is relevant for describing variations in social and economic activities. This indicator was applied to a case study of a natural disaster, that is Hurricane Irma in 2017. The hurricane caused fatalities and destruction in the Caribbean islands of Saint Martin and Saint Barthelemy, which are two French overseas territories. Energy production after Hurricane Irma exhibited a significant decrease due to the destruction of the electricity network as well as perturbations in economic and social activities. The energy production restoration rate was higher in Saint Barthelemy than in Saint Martin. The electricity restoration rate after a disaster was almost constant. However, the energy production 18 months after Hurricane Irma was identical to that before Hurricane Irma in Saint Barthelemy; this was not the case in Saint Martin. During resilience, an increase in the gap between energy production in Saint Barthelemy and Saint Martin was observed. This study indicated that this gap represents an inequality growth between Saint Barthelemy (gross domestic product (GDP) of 40 000 euros/inhabitant) and Saint Martin (GDP of 16 600 euros/inhabitant). The indicators emphasized that inequality growth after natural disasters favors less vulnerable and more resilient territories. The number of inhabitants must be considered during indicator construction to avoid any bias."
2201.00336,Visilence: An Interactive Visualization Tool for Error Resilience Analysis,"['Shaolun Ruan', 'Yong Wang', 'Qiang Guan']",ARXIV,http://arxiv.org/pdf/2201.00336v1,2022-01-02T11:15:29Z,2022-01-02T11:15:29Z,['10.48550/arXiv.2201.00336'],"Soft errors have become one of the major concerns for HPC applications, as those errors can result in seriously corrupted outcomes, such as silent data corruptions (SDCs). Prior studies on error resilience have studied the robustness of HPC applications. However, it is still difficult for program developers to identify potential vulnerability to soft errors. In this paper, we present Visilence, a novel visualization tool to visually analyze error vulnerability based on the control-flow graph generated from HPC applications. Visilence efficiently visualizes the affected program states under injected errors and presents the visual analysis of the most vulnerable parts of an application. We demonstrate the effectiveness of Visilence through a case study."
2201.00220,Turath-150K: Image Database of Arab Heritage,"['Dani Kiyasseh', 'Rasheed El-Bouri']",ARXIV,http://arxiv.org/pdf/2201.00220v1,2022-01-01T17:36:25Z,2022-01-01T17:36:25Z,['10.48550/arXiv.2201.00220'],"Large-scale image databases remain largely biased towards objects and activities encountered in a select few cultures. This absence of culturally-diverse images, which we refer to as the hidden tail, limits the applicability of pre-trained neural networks and inadvertently excludes researchers from under-represented regions. To begin remedying this issue, we curate Turath-150K, a database of images of the Arab world that reflect objects, activities, and scenarios commonly found there. In the process, we introduce three benchmark databases, Turath Standard, Art, and UNESCO, specialised subsets of the Turath dataset. After demonstrating the limitations of existing networks pre-trained on ImageNet when deployed on such benchmarks, we train and evaluate several networks on the task of image classification. As a consequence of Turath, we hope to engage machine learning researchers in under-represented regions, and to inspire the release of additional culture-focused databases. The database can be accessed here: danikiyasseh.github.io/Turath."
2201.00434,TVNet: Temporal Voting Network for Action Localization,"['Hanyuan Wang', 'Dima Damen', 'Majid Mirmehdi', 'Toby Perrett']",ARXIV,http://arxiv.org/pdf/2201.00434v1,2022-01-02T23:46:18Z,2022-01-02T23:46:18Z,['10.48550/arXiv.2201.00434'],"We propose a Temporal Voting Network (TVNet) for action localization in untrimmed videos. This incorporates a novel Voting Evidence Module to locate temporal boundaries, more accurately, where temporal contextual evidence is accumulated to predict frame-level probabilities of start and end action boundaries. Our action-independent evidence module is incorporated within a pipeline to calculate confidence scores and action classes. We achieve an average mAP of 34.6% on ActivityNet-1.3, particularly outperforming previous methods with the highest IoU of 0.95. TVNet also achieves mAP of 56.0% when combined with PGCN and 59.1% with MUSES at 0.5 IoU on THUMOS14 and outperforms prior work at all thresholds. Our code is available at https://github.com/hanielwang/TVNet."
2201.00347,Observations of asteroid magnitude-phase relations at the Kharadze Abastumani Astrophysical Observatory,"['V. G. Shevchenko1', 'R. Ya. Inasaridze', 'Yu. N. Krugly', 'V. V. Ayvazian', 'G. V. Kapanadze', 'G. Datashvili', 'I. G. Slyusarev', 'V. G. Chiorny', 'I. E. Molotov']",ARXIV,http://arxiv.org/pdf/2201.00347v1,2022-01-02T12:35:10Z,2022-01-02T12:35:10Z,['10.48550/arXiv.2201.00347'],In frame of an implementation of the cooperative program studying of asteroids between the Kharadze Abastumani Astrophysical Observatory and the Astronomical Institute of V.N. Karazin Kharkiv National University the observations for five main-belt asteroids were performed to obtain their magnitude-phase relations and other physical characteristics. Preliminary results of the photometrical observations for the large dark asteroid (1390) Abastumani are presented.
2201.00152,On structure theorems and non-saturated examples,"['Qinqi Wu', 'Hui Xu', 'Xiangdong Ye']",ARXIV,http://arxiv.org/pdf/2201.00152v1,2022-01-01T09:27:21Z,2022-01-01T09:27:21Z,['10.48550/arXiv.2201.00152'],"For any minimal system $(X,T)$ and $d\geq 1$ there is an associated minimal system $(N_{d}(X), \mathcal{G}_{d}(T))$, where $\mathcal{G}_{d}(T)$ is the group generated by $T\times\cdots\times T$ and $T\times T^2\times\cdots\times T^{d}$ and $N_{d}(X)$ is the orbit closure of the diagonal under $\mathcal{G}_{d}(T)$. It is known that the maximal $d$-step pro-nilfactor of $N_d(X)$ is $N_d(X_d)$, where $X_d$ is the maximal $d$-step pro-nilfactor of $X$. In this paper, we further study the structure of $N_d(X)$. We show that the maximal distal factor of $N_d(X)$ is $N_d(X_{dis})$ with $X_{dis}$ being the maximal distal factor of $X$, and prove that as minimal systems $(N_{d}(X), \mathcal{G}_{d}(T))$ has the same structure theorem as $(X,T)$. In addition, a non-saturated metric example $(X,T)$ is constructed, which is not $T\times T^2$-saturated and is a Toeplitz minimal system."
2201.00208,Lagrangian fillings for Legendrian links of finite or affine Dynkin type,"['Byung Hee An', 'Youngjin Bae', 'Eunjeong Lee']",ARXIV,http://arxiv.org/pdf/2201.00208v2,2022-01-01T15:19:10Z,2022-02-08T18:23:51Z,['10.48550/arXiv.2201.00208'],"We prove that there are at least as many exact embedded Lagrangian fillings as seeds for Legendrian links of finite type $\mathsf{ADE}$ or affine type $\tilde{\mathsf{D}} \tilde{\mathsf{E}}$. We also provide as many Lagrangian fillings with rotational symmetry as seeds of type $\mathsf{B}$, $\mathsf{G}_2$, $\tilde{\mathsf{G}}_2$, $\tilde{\mathsf{B}}$, or $\tilde{\mathsf{C}}_2$, and with conjugation symmetry as seeds of type $\mathsf{F}_4$, $\mathsf{C}$, $\mathsf{E}_6^{(2)}$, $\tilde{\mathsf{F}}_4$, or $\mathsf{A}_5^{(2)}$. These families are the first known Legendrian links with (infinitely many) exact Lagrangian fillings (with symmetry) that exhaust all seeds in the corresponding cluster structures beyond type $\mathsf{A} \mathsf{D}$. Furthermore, we show that the $N$-graph realization of (twice of) Coxeter mutation of type $\tilde{\mathsf{D}} \tilde{\mathsf{E}}$ corresponds to a Legendrian loop of the corresponding Legendrian links. Especially, the loop of type $\tilde{\mathsf{D}}$ coincides with the one considered by Casals and Ng."
2201.00417,Non-local parameterization of atmospheric subgrid processes with neural networks,"['Peidong Wang', 'Janni Yuval', ""Paul A. O'Gorman""]",ARXIV,http://arxiv.org/pdf/2201.00417v2,2022-01-02T20:55:18Z,2022-12-26T02:24:50Z,"['10.48550/arXiv.2201.00417', '10.1029/2022MS002984']","Subgrid processes in global climate models are represented by parameterizations which are a major source of uncertainties in simulations of climate. In recent years, it has been suggested that machine-learning (ML) parameterizations based on high-resolution model output data could be superior to traditional parameterizations. Currently, both traditional and ML parameterizations of subgrid processes in the atmosphere are based on a single-column approach, which only use information from single atmospheric columns. However, single-column parameterizations might not be ideal since certain atmospheric phenomena, such as organized convective systems, can cross multiple grid boxes and involve slantwise circulations that are not purely vertical. Here we train neural networks (NNs) using non-local inputs spanning over 3$\times$3 columns of inputs. We find that including the non-local inputs improves the offline prediction of a range of subgrid processes. The improvement is especially notable for subgrid momentum transport and for atmospheric conditions associated with mid-latitude fronts and convective instability. Using an interpretability method, we find that the NN improvements partly rely on using the horizontal wind divergence, and we further show that including the divergence or vertical velocity as a separate input substantially improves offline performance. However, non-local winds continue to be useful inputs for parameterizating subgrid momentum transport even when the vertical velocity is included as an input. Overall, our results imply that the use of non-local variables and the vertical velocity as inputs could improve the performance of ML parameterizations, and the use of these inputs should be tested in online simulations in future work."
